{
  "created_at": "2026-08-17T00:00:00+00:00",
  "integrity": {"algorithm": "sha256", "payload_sha256": "0f826993d4aa38a290aeffcbd4d736f80b3f3d2d3f72a6275e169414e66fd4e2", "signed": false},
  "receipt_id": "known-good:tabular-regression@1.0.0",
  "schema_version": "evaluation-receipt/v1",
  "scope": "shareable",
  "shareable": {
    "artifacts": [],
    "benchmark": {"domain": "tabular", "id": "community-tabular-regression", "protocol": "prediction-table/v1", "suite": "community-pack", "version": "1.0.0"},
    "evaluation": {
      "input_schema": {"class_labels": [], "metadata_columns": ["site", "batch"], "prediction_columns": ["prediction"], "sample_id_column": "sample_id", "sample_id_status": "present", "schema_version": "prediction-table/v1", "slice_columns": ["site", "batch"], "split_column": null, "target_column": "target"},
      "metric_source": "reported_metrics",
      "metrics": {"mae": 0.023750000000000018, "r2": 0.9894379055591449, "rmse": 0.024238399287081665},
      "sample_counts": {"n_samples": 8}, "slices": {}, "task_type": "regression", "uncertainty": {}
    },
    "privacy": {"audits": {}, "mechanism": {"formal_dp": false, "guarantee_level": "none", "mode": "none"}, "release": {"status": "pass"}},
    "provenance": {"attestation_id": "known-good", "package": {"name": "private-lab-bench", "version": "0.11.0"}},
    "run": {"created_at": "2026-08-17T00:00:00+00:00", "project": "community-tabular-regression", "report_type": "prediction_evaluation", "run_id": "known-good", "task": "predictions"}
  }
}
